{
  "Vorname": "Arthur",
  "Nachname": "Fischer",
  "Hauptrolle": {
    "Titel": "Hauptrolle",
    "Beschreibung": "IT-Projektmanager und Business Analyst"
  },
  "Nationalität": "Deutschland",
  "Hauptausbildung": "Master of Science – Technische Betriebsführung",
  "Kurzprofil": "Leidenschaftlicher IT-Projektmanager und Business Analyst mit Fokus auf die Umsetzung komplexer IT- und Digitalisierungsprojekte. Langjährige Erfahrung in Projekt- und Programmmanagement, Produktentwicklung sowie Prozessoptimierung. Starker Praxisbezug in agilen Frameworks, Cloud-Lösungen und datengetriebenen Entscheidungsgrundlagen mit klarem Fokus auf Qualität, Budgettreue und nachhaltigen Mehrwert.",
  "Expertise": {
    "Fachwissen_und_Schwerpunkte": [
      {
        "Kategorie": "Projektmethodik",
        "BulletList": [
          "Projekt- und Programmmanagement",
          "Agile Frameworks (Scrum, Kanban)",
          "Release- und Ressourcenmanagement"
        ]
      },
      {
        "Kategorie": "Tech Stack & Tools",
        "BulletList": [
          "Cloud-Lösungen (Azure, AWS)",
          "Grundlagen Python und AI-gestützte Tools",
          "ERP-Systeme und SaaS-Plattformen"
        ]
      },
      {
        "Kategorie": "Weitere Skills",
        "BulletList": [
          "Business Analyse und Requirements Engineering",
          "Stakeholder-Management und Kommunikation",
          "Prozessoptimierung und Lean-Management"
        ]
      }
    ]
  },
  "Aus_und_Weiterbildung": [
    {
      "Zeitraum": "! fehlt – bitte prüfen!",
      "Institution": "Technische Universität Dortmund",
      "Abschluss": "Master of Science – Technische Betriebsführung"
    },
    {
      "Zeitraum": "! fehlt – bitte prüfen!",
      "Institution": "Leuphana Universität Lüneburg",
      "Abschluss": "Bachelor of Engineering"
    }
  ],
  "Trainings_und_Zertifizierungen": [
    {
      "Zeitraum": "2025",
      "Institution": "! fehlt – bitte prüfen!",
      "Titel": "Certified Crypto Finance Expert"
    },
    {
      "Zeitraum": "2023",
      "Institution": "Kanban University",
      "Titel": "Kanban"
    },
    {
      "Zeitraum": "2023",
      "Institution": "Scrum.org",
      "Titel": "Professional Scrum Master I (PSM I)"
    },
    {
      "Zeitraum": "2021",
      "Institution": "RWTH Aachen",
      "Titel": "Chief ERP Project Manager"
    }
  ],
  "Sprachen": [
    {
      "Sprache": "Deutsch",
      "Level": 5
    },
    {
      "Sprache": "Englisch",
      "Level": 4
    },
    {
      "Sprache": "Französisch",
      "Level": 2
    }
  ],
  "Ausgewählte_Referenzprojekte": [
    {
      "Zeitraum": "01/2024 - 09/2025",
      "Rolle": "IT-Projektmanager / Product Owner",
      "Kunde": "Selbstständiges Projekt – Digital Platform Development",
      "Tätigkeiten": [
        "Aufbau einer SaaS-Plattform mit Cloud- und AI-Komponenten",
        "Definition von Produktvision, Roadmap und Backlog",
        "Einführung agiler Frameworks (Scrum, Kanban)",
        "Entwicklung von KPI-Dashboards und Performance-Monitoring",
        "Release- und Qualitätsmanagement"
      ],
      "Technologien": "Cloud, Azure, Python, AI-Tools, Dashboards",
      "Methodik": "Scrum, Kanban"
    },
    {
      "Zeitraum": "06/2019 - 03/2022",
      "Rolle": "IT-Projektmanager",
      "Kunde": "Asseco Solutions AG",
      "Tätigkeiten": [
        "Projektmanagement für IT-Projekte in verschiedenen Branchen",
        "Koordination von Stakeholdern, Entwicklungsteams und Dienstleistern",
        "Budget- und Ressourcensteuerung",
        "Projektcontrolling und Reporting",
        "Optimierung bestehender Prozesssysteme"
      ],
      "Technologien": "ERP-Systeme, Reporting-Tools",
      "Methodik": "Scrum, Kanban"
    },
    {
      "Zeitraum": "04/2016 - 05/2019",
      "Rolle": "IT-Berater / Projektmanager",
      "Kunde": "Mercedes-AMG / Daimler / Porsche Engineering",
      "Tätigkeiten": [
        "IT-Beratung und Projektmanagement in Industrieprojekten",
        "Planung und Koordination von Systemimplementierungen",
        "Stakeholder-Management in internationalen Projekten",
        "Release- und Qualitätsmanagement"
      ],
      "Technologien": "ERP-Systeme, Produktions-IT",
      "Methodik": "Projektmanagement, Agile"
    },
    {
      "Zeitraum": "08/2014 - 08/2015",
      "Rolle": "Projektmitarbeiter Qualitätsmanagement",
      "Kunde": "Kiekert AG",
      "Tätigkeiten": [
        "Optimierung globaler Qualitätsprozesse",
        "Aufbau und Pflege eines Dokumentenmanagementsystems",
        "Analyse und Reporting von Qualitätskennzahlen"
      ],
      "Technologien": "Datenbanken, Reporting-Tools",
      "Methodik": "Lean, Prozessmanagement"
    },
    {
      "Zeitraum": "04/2013 - 06/2013",
      "Rolle": "Projektmitarbeiter Produktionsplanung",
      "Kunde": "Daimler AG",
      "Tätigkeiten": [
        "Planung und Optimierung von Fertigungsprozessen",
        "Durchführung von MTM-Analysen",
        "Mitarbeit bei FMEAs und Produktionstests"
      ],
      "Technologien": "ERP APplus, Produktionssysteme",
      "Methodik": "Lean, Prozessanalyse"
    }
  ]
}
